Gene,Allele,Locus Name,Allele Name,Synonyms of Allele,Phenoptype,Chromosome,Marker Type,Mutant Type,
pen,--,pendens, , ,"Broadly spreading, drooping, glossy, and yellowish pinnae.",2,Morph,RAD,
per,--,perviridis, , ,"Leaves darker green, dropping early, anthocyanin strong; very small, slow-growing plants.",1,Morph,RAD,
pet,--,penetrabile, ,"pet-2, pet2","Plant small, stocky shoots; short internodes and leaves; rugose pinnae; heterozygote intermediate at season's end.  Note: leaves broad and round.",11,Morph,RAD,
pf,--,parviflora, , ,"Plants reach half normal size; internodes and leaves shortened; leaf segments small, narrow, keeled, dark grey-green; branch tips purplish; flowers smaller, petioles narrow and slightly paler.", ,Morph, ,
pg,--,pale green, ,pg329,"Cotyledons first pale yellow, turn gray-green, which is mature plant color; slow growing.", ,Morph, ,
pg-2,--,pale green-2, ,"pg2, pa, pg390",Cotyledons and leaves pale-green., ,Morph, ,
pg-3,--,pale green-3, ,"pg3, pl, pg391",Cotyledons pale gray-green; leaves fading to dull yellow color., ,Morph, ,
Pgdh-1,--,6-Phosphogluconate dehydrogenase-1, , , ,4,Isozyme,SPON,
Pgdh-2,1,6-Phosphogluconate dehydrogenase-2, , , ,12,Isozyme,SPON,
Pgdh-3,1,6-Phosphogluconate dehydrogenase-3, , , ,5,Isozyme,SPON,
Pgi-1,1,Phosphoglucoisomerase-1, , , ,12,Isozyme,SPON,
Pgi-1,2,Phosphoglucoisomerase-1, , , ,12,Isozyme,SPON,
Pgm-1,1,Phosphoglucomutase-1, , , ,3,Isozyme,SPON,
Pgm-2,1,Phosphoglucomutase-2, , , ,4,Isozyme,SPON,
Ph,--,Phytophthora infestans resistance, ,"PiT, TR1","Resistant  to Phytophthora infestans race T:0,  susceptible to  race T:0.",7,Disease,SPON,
Ph-2,--,Phytophthora infestans resistance-2, , ,Phytophthora infestans resistance.,10,Disease,SPON,
Ph-3,--,Phytophthora infestans resistance-3, , , ,9,Disease, ,
Phf,--,Phytophthora infestans field resistance, , ,Incompletely dominant., ,Disease, ,
Phf-2,--,Phytophthora infestans field resistance2, , ,Incompletely dominant., ,Disease, ,
phyB2,--,phytochrome B2, , ,"In combination with phyB1 (tri), increases internodes are elongated and leaves are chlorotic; alone, phenotype is normal..",5,Morph,RAD,
pi,--,pistillate, , ,"Only vestiges of stamens present; calyx and corolla segments slender, elongate, strap shaped, and unequal in size; pistil distorted in varying fashion; small, extra locules usually present; inflorescences indeterminate; no pollen produced, and high ovule sterility.", ,Morph,SPON,
pi-2,--,pistillate-2, , ,"Plant size and vigor reduced; inflorescences tending to abort; flowers small with only calyx and pistil; calyx subnormal, tightly adpressed to pistil; female fertility and/or fruit set affected.", ,Morph,CHEM,
pic,--,picta, , ,"Leaves at first normal green, later turning yellowish then brown necrotic above, some eventually brown below.", ,Morph,RAD,
pic-2,--,picta-2, ,pic2,"Young pinnae with marginal necrotic flecking, later more numerous.", ,Morph, ,
pic-3,--,picta-3, ,pic3,"Plant diminutive in all parts; pinnae light yellow-green turning necrotic at tips, dying early.", ,Morph, ,
pic-4,--,picta-4, ,pic4,"Scattered necrotic flecks on smaller, light gray to olive green pinnae.", ,Morph, ,
pin,--,pinnosa, ,pin1,"Small, flat bush; short internodes, leaves; keeled, sometimes yellowish, light green pinnae.", ,Morph, ,
pl,--,perlucida, ,pl1,"Light green, narrow pinnae, yellowing prematurely.",7,Morph,RAD,
pla,--,plana, , ,"Small plant, stiff when young, yellowish to light green leaves darker veins.",9,Morph,RAD,
pla-2,--,plana-2, ,pla2,Longer hypocotyl; larger cotyledons and pinnae., ,Morph, ,
pli,--,plicata, , ,"All parts small; leaves dark, yellowish, plicate; strong anthocyanin.",3,Morph,RAD,
pli-2,--,plicata-2, ,pli2,"Small, lax bush; slender shoots, short internodes; smaller gray-green pinnae.", ,Morph, ,
pm,--,praematura, ,pm1,"Small plant; dainty, shorter, sometimes yellowish leaves; fruit ripen early.", ,Morph,RAD,
pm-2,--,praematura-2, ,pm2,"Short internodes; small, rounded, crowded, dark green pinnae; fruit ripen early.", ,Morph, ,
pma,--,praemortua, , ,"Plants reach 1/4 normal size, weakly branched; leaves reduced; starting at flowering: stem epidermis becomes dry; brown, silvery, leaves gradually necrose; fruit set good for plant size.", ,Morph, ,
Pn,--,Punctate, , ,Heavy anthocyanin accumulation at base of large trichomes on upper leaf surface.,8,Morph,SPON,
pol,--,polylopha, , ,Short internodes; leaves plicate and twisted; fruit flat and fasciated., ,Morph,RAD,
pol-2,--,polyopha-2, ,pol2,"Main, lateral shoots end in large branched inflorescence with large, fasciated central flower; fruit flattened 4 to 9 locules.", ,Morph, ,
Pox,--,Poxed fruit, , , , ,Morph,SPON,
pp,--,polyphylla, ,pp1,"Longer, more divided, lighter-colored leaves, micromutation.", ,Morph,RAD,
ppa,--,purpurea, , ,"In early stages indistinguishable from elu; as fruits set, becomes distinguishable by its high anthocyanin content.", ,Morph,RAD,
ppa,2,purpurea, , ,"In early stages indistinguishable from elu; as fruits set, becomes distinguishable by its high anthocyanin content.", ,Morph,RAD,
ppi,--,paucipinnata, , ,"Plants always retarded, weakly branched, shortened internodes; leaves often with 1 pair of segments, acuminate, slightly keeled; reduced fruit set.", ,Morph, ,
pr,--,propeller, , ,"Cotyledons propeller like; true leaves greatly modified: leaf lamina narrow, twisted, and mottled.",1,Morph,RAD,
pra,--,praeclusa, , ,"Cotyledons short, broad, bent downwards on strong hypocotyls; plants(seen only in greenhouse) of variable height 10-40 cm; habit upright with no branches; leaves extremely foreshortened and crupled with 1-2  partial segments, dark green, strongly blistered and curled; inflorescence greatly reduced; no fruit set; maintained via heterozygotes; resembles Cu.", ,Morph, ,
pra-2,--,praeclusa-2, , ,"Plant always severely retarded, reaching 10-20 cm, unbranched, seem very thick; leaves and cotyledons small, dark green, leaves very rugose; no inflorescences seen; maintained via heterozygotes.", ,Morph, ,
prc,--,procumbens, , ,Shortened internodes and leaves; rugose leaves lightly mottled yellow.,6,Morph,RAD,
prc-2,--,procumbens-2, ,prc2,Older stems become prostrate., ,Morph, ,
prc-3,--,procumbens-3, ,prc3,Prostrate cushiony plant; elongated leaves with fewer long stalked pinnae., ,Morph, ,
pre,--,pressa, , ,"Plants attain 1/3 height; habit weakly branched, semi-erect and slender; angle of leaf emergence very narrow; leaves very short, segments relatively coarse and plicate; fruit development reduced.", ,Morph,RAD,
pro,--,procera, , ,"More rapid growth rate; few foliolules, larger segments entire.  Tall, slender, weak plant.  Increases internode  length, the number of internodes before the first inflorescence and the total number of internodes.",11,Morph,RAD,
prt,--,protea, ,prt1,"Smaller plant, variably reduced; pinnae keeled, pale-yellow, partly shiny, leathery.", ,Morph,RAD,
prun,--,prunoidea, , ,"All parts, particularly fruit, are elongated; traits weakly dominant.",2,Morph,RAD,
prun-2,--,prunoidea-2, ,prun2,"Elongated hypocotyl internodes, leaves, fruit; very lax habit.", ,Morph, ,
Prx-1,1,Peroxidase-1, , , ,1,Isozyme,SPON,
Prx-1,2,Peroxidase-1, , , ,1,Isozyme,SPON,
Prx-1,3,Peroxidase-1, , , ,1,Isozyme,SPON,
Prx-1,4,Peroxidase-1, , , ,1,Isozyme,SPON,
Prx-1,5,Peroxidase-1, , , ,1,Isozyme,SPON,
Prx-1,n,Peroxidase-1, , , ,1,Isozyme,SPON,
Prx-2,1,Peroxidase-2, , , ,2,Isozyme,SPON,
Prx-2,3,Peroxidase-2, , , ,2,Isozyme,SPON,
Prx-2,n,Peroxidase-2, , , ,2,Isozyme,SPON,
Prx-3,1,Peroxidase-3, , , ,2,Isozyme,SPON,
Prx-3,2,Peroxidase-3, , , ,2,Isozyme,SPON,
Prx-3,a1,Peroxidase-3, , , ,2,Isozyme,SPON,
Prx-3,n,Peroxidase-3, , , ,2,Isozyme,SPON,
Prx-3a,1,Peroxidase-3a, , , , ,Isozyme, ,
Prx-4,1,Peroxidase-4, , , ,10,Isozyme,SPON,
Prx-4,10,Peroxidase-4, , , ,10,Isozyme,SPON,
Prx-4,11,Peroxidase-4, , , ,10,Isozyme,SPON,
Prx-4,12,Peroxidase-4, , , ,10,Isozyme,SPON,
Prx-4,13,Peroxidase-4, , , ,10,Isozyme,SPON,
Prx-4,14,Peroxidase-4, , , ,10,Isozyme,SPON,
Prx-4,15,Peroxidase-4, , , ,10,Isozyme,SPON,
Prx-4,16,Peroxidase-4, , , ,10,Isozyme, ,
Prx-4,17,Peroxidase-4, , , ,10,Isozyme,SPON,
Prx-4,18,Peroxidase-4, , , ,10,Isozyme,SPON,
Prx-4,19,Peroxidase-4, , , ,10,Isozyme,SPON,
Prx-4,2,Peroxidase-4, , , ,10,Isozyme,SPON,
Prx-4,20,Peroxidase-4, , , ,10,Isozyme,SPON,
Prx-4,21,Peroxidase-4, , , ,10,Isozyme,SPON,
Prx-4,22,Peroxidase-4, , , ,10,Isozyme,SPON,
Prx-4,23,Peroxidase-4, , , ,10,Isozyme,SPON,
Prx-4,3,Peroxidase-4, , , ,10,Isozyme,SPON,
Prx-4,4,Peroxidase-4, , , ,10,Isozyme,SPON,
Prx-4,5,Peroxidase-4, , , ,10,Isozyme,SPON,
Prx-4,6,Peroxidase-4, , , ,10,Isozyme,SPON,
Prx-4,7,Peroxidase-4, , , ,10,Isozyme,SPON,
Prx-4,8,Peroxidase-4, , , ,10,Isozyme,SPON,
Prx-4,9,Peroxidase-4, , , ,10,Isozyme,SPON,
Prx-6,--,Peroxidase-6, , , ,3,Isozyme, ,
Prx-7,1,Peroxidase-7, , , ,3,Isozyme,SPON,
Prx-7,2,Peroxidase-7, , , ,3,Isozyme,SPON,
Prx-7,n,Peroxidase-7, , , ,3,Isozyme,SPON,
Prx-7a,n,Peroxidase-7a, , , , ,Isozyme, ,
ps,--,positional sterile, ,va,"Essentially cleistogamous in respect to opening of the corolla; corolla normal in color  and probably also in size, but segments are so tightly bound in dorsal grooves of the anthers, into which they normally fold in the bud, that they do not ordinarily unfurl; stomia of the anthers usually do not open during the life of the flower, thereby preventing self pollination; pollen of normal viability; depending onf the genotypic background and environmental conditions, occasional flowers may open or set fruit from sefl-pollination.",2,Morph,SPON,
ps,prov2,positional sterile,provisional 2,ps,Corolla does not unfurl; pollen is not shed.,2,Morph,SPON,
ps-2,--,positional sterile-2, , ,Positional sterile flowers; pollen is not shed.  .,4,Morph,SPON,
psa,--,perspicua, , ,"Plants attain 1/2-3/4 normal size; early leaves pale light green; pinnae bent strongly upwards and more serrate, exposing undersides; distinctive yellowish light green color with exposed pale green lower surface.", ,Morph,RAD,
pst,--,persistent style, , ,Style adnate to fruit throughout development; fruit becomes strongly beaked.,7,Morph,SPON,
psu,--,paucisurcata, , ,"Plant small, almost without branches; internodes and leaves strongly shrotened; leaf segments very small, light keeled, dull grey-green; flowers small; fruit set variably low.", ,Morph, ,
pt,--,petite, , ,"Small, slow-growing chlorotic plants; light green cotyledons; frequently tricot or bifid.", ,Morph,RAD,
pt-4,--,pseudo-triplo-4, , ,"Resembles triplo-4 in dainty habit, elongate leaf and flower parts; differs in defective flowers.",11,Morph,SPON,
pta,--,partiaria, , ,"Seedling and plant habit normal; leaf segments narrow, dainty with deeper serration and plicate, tending to be pendant; foliolules more abundant.", ,Morph,RAD,
ptb,--,protuberant, , ,"Stylar end of mature fruit markedly pointed, protuberant.", ,Morph,SPON,
Pto,--,Pseudomonas syringae pv tomato resis., , ,"Resistance to Pseudomonas syringae pv. Tomato, race zero sensitive to insecticide Fenthion.",5,Disease,SPON,
Pto,2,Pseudomonas syringae pv tomato resis., , ,Resistance to Pseudomonas syringae pv. tomato.,5,Disease,SPON,
Pto,h,Pseudomonas syringae pv tomato resis.,hirsutum, ,Resistance to Pseudomonas syringae without Fenthion sensitivity,5,Disease,SPON,
Pto,Pto-2,Pseudomonas syringae pv tomato resis., ,Pto-2,Resistance to Pseudomonas syringae pv. tomato.,5,Disease,SPON,
Pts,--,Petroselinum, , ,"Leaves resemble plain parsley foliage in being excessively divided (to the 3rd and 4th order in homozygotes, heterozygotes are intermediate).",6,Morph,SPON,
ptu,--,punctulata, , ,"Bushy habit with slightly shorter internodes; cotyledons and primary leaves are light green with white-green background; foliage dull light grey-green, yellow-light green virescent with fine white-yellow spots; shoot tips bluish.", ,Morph, ,
pu,--,pulvinata, ,pul,"Shortened internodes, stronger branching; elongate cotyledons; leaflets broad and much divided.", ,Morph,RAD,
pu,2,pulvinata, ,pu2,"Shortened internodes, stronger branching; elongate cotyledons; leaflets broad and much divided.", ,Morph,RAD,
pum,--,pumila, , ,"Tiny, dainty plant with few or no branches; slow growth rate.",9,Morph,RAD,
pun,--,punctata, ,pun1,"Smaller plant, variably branched; narrow, keeled, firm pinnae, mostly finely variegated or mottled  in light to dark-green.", ,Morph,RAD,
pun-2,--,punctata-2, ,pun2,"Pinnae, filiform, thick, gray-green.", ,Morph, ,
pur,--,purilla, , ,"Plants much retarded, erect, and little branched; leaf edges yellow with normal green veins.", ,Morph,RAD,
pur,gra,purilla,gracilis,gra,"Very small, unbranched, delicate plants; much reduced leaves yellowing at margins.", ,Morph,RAD,
pus,--,pustulata, ,pus1,"Strongly rugose, broad, rounded pinnae; stutdy, erect bush; dark green foliage at all stages", ,Morph, ,
pv,--,pulviniformis, , ,"Plants reach 1/4 to 1/3 pm size, habit cushion like via controlled growth of side shoots; leaves shortened, older ones prematurely yellowing, later drying; young stems normal, developing brown. sunken spots later.", ,Morph, ,
pvs,--,parvistata, , ,"Plants always small, reaching 1/4 normal size; internodes and leaves shortened, leaf segments small, bright, dark green below; shoot tips bluish with anthocyanin.", ,Morph, ,
px,--,praecox, ,px1,"Lax, spreading plant; small pinnae; larger, earlier fruit.", ,Morph,RAD,
py,--,pyramidalis, , ,"Cotyledons wider, hypocotyl shorter; plants reach 2/3 normal height; habit first upright, weakly branched, later becoming pyrimidal, leaves at this time are irregularly epinastic; terminal segments broader; foliage color shiny dark yellowish.", ,Morph,RAD,
pyl,--,Pyrenochaeta lycopersici resistance, ,"py, py-1","Resistance to corky root; heterozygote intermediate, varies with environment.",3,Disease,SPON,
r,--,yellow flesh, , ,"Yellow color of ripe fruit flesh; synthesis of lycopene is inhibited; associated with paler corolla color, which often affords a satisfactory classification at flowering stage.",3,Morph,SPON,
r,(1s),yellow flesh, ,r^2,Yellow color of ripe fruit flesh.,3,Morph,SPON,
r,(2s),yellow flesh, ,"r^3, r-2, r2",Yellow fruit flesh; lighter yellow flowers.,3,Morph,RAD,
r,prov4,yellow flesh,provisional 4,r,Yellow color of ripe fruit flesh.,3,Morph,SPON,
r,prov5,yellow flesh,provisional 5,r,Yellow color of ripe fruit flesh.,3,Morph,SPON,
r,y,yellow flesh,reddish yellow,ry,Likely allele of r with reddish flesh tones in ripe fruit,3,Morph, ,
ra,--,rava, , ,Leaves down curled and gray-green; larger trichomes longer and silky.,4,Morph,RAD,
ra,2,rava, ,gri,"Small plant; leaves small, strongly recurved dorsally, light yell to gray-green; trichomes longer.",4,Morph,RAD,
ra-2,--,rava-2, ,ra2,Cotyledons heavily dotted in white; purplish hypocotyl; smaller lax plant., ,Morph, ,
ram,--,ramosissima, ,ram1,Variably branched inflorescence; proportionately reduced all other plant parts., ,Morph, ,
ran,--,ranificans, ,ran1,"Slender shoots, pinnae, petals; variably branched inflorescence.", ,Morph, ,
rc,--,rolled cotyledons, , ,Retarded growth; cotyledons uprolled., ,Morph, ,
rd,--,reduced, , ,In greenhouse plants grow normally to about 30 cm height; thereafter grow slowly or not at all; intolerant of field conditions., ,Morph,SPON,
re,--,reptans, , ,"Seedlings inclined from epicotyl, mature plants recumbent; elongate internodes; less branched.",8,Morph,RAD,
rea,--,repleta, ,rea1,Plant denser; crowded pinnae on shorter leaves of light yellow-green., ,Morph, ,
ref,--,refrenata, ,ref1,"Strongly retarded growth; sturdy shoots; short leaves; small, narrow pinnae.", ,Morph, ,
rela,--,relaxata, , ,Lax open habit; tiny plants; light green yellow tinged leaves; heterozygotes intermediate color.,9,Morph,RAD,
rep,--,repens, , ,"Strong creeping tendency even in seedling; less branching; shortened, prematurely dying leaves; mimics 'lazy' series by strong reversed geotropism  of shoots.", ,Morph,RAD,
rep-2,--,repens-2, , ,"Early growth typical spl; from flowering on, all  parts develop plagiotropecally, exposing fruits, which ripen earlier than normal.", ,Morph,RAD,
rep-3,--,repens-3, , ,"Plants reach 1/3 normal size, weakly branched and plagiotropic, internodes and leaves shortened; foliage light grey-green; leaves necrose prematurely; fruits relatively large.", ,Morph, ,
res,--,restricta, ,res1,"Smaller, squarrose bush; yellowish light-green, boat-shaped pinnae, purplish ventrally.",10,Morph,RAD,
Rg-1,--,Regeneration-1, , ,High shoot regeneration capacity from callus cultures established from root explants.,3,Morph,SPON,
Rg-2,--,Regeneration-2, , ,High shoot regeneration capacity.,3,Morph,SPON,
ri,--,ridged, ,rl,Ridged leaves; retarded growth of shoots and roots.,6,Morph,RAD,
ria,--,rigidula, ,ria1,"Smaller plant; stiff, yellowish young leaves turn dark-green later.",7,Morph,RAD,
ria,2,rigidula, ,ria1^2,"Smaller, stiff, compact plant; erect sideshoots; young pinnae keeled to involuted light yellow-green, dark veins, purplish below.",7,Morph,RAD,
rig,--,rigida, , ,"Plant small, rigidly erect when young; leaves yellowish,  and darkening later.",8,Morph,RAD,
rig,2,rigida, ,"pca,  pca1","Small, lax, spreading plant; pinnae keeled, yellowish to light-green; early flowereing, ripeninging; heterozygote recognizable.",8,Morph,RAD,
rig-2,--,rigida-2, , ,"Plant small, rigidly erect when young; leaves yellowish,  and darkening later.", , ,RAD,
rin,--,ripening inhibitor, , ,"Fruits green at maturity, later turning bright yellow, retarded ripening.",5,Morph,SPON,
rl,--,radial cracking resistance, ,ra,Resistance of fruit to radial cracking., ,Morph,SPON,
ro,--,rosette, , ,"Internodes extremely short, inducing rosette plant heart; no flowers, but vistigial buds formed on older plants; height 6 inches or less; reduced branching of root system, producing a single tap root; leaflets narrower than normal.",2,Morph,RAD,
roa,--,rotundata, ,roa1,"Small plant; short internodes, leaves; broad, rounded, rugose, light gray-green pinnae.", ,Morph,RAD,
roa-2,--,rotundata-2, ,roa2,"Rounded, slightly rugose pinnae; shortened leaves", , , ,
rot,--,rotundifolia, , ,"Short internodes; short, broad, rugose leaves.",7,Morph,RAD,
rot-2,--,rotundifolia-2, ,rot2,"Small plant; short internodes, sidshoots; small, broad pinnae, nearly round.", ,Morph, ,
rpa,--,repetita, , ,"Seedling size variable; plants weak, attaining 1/3 size; habit weakly branched, upright; leaves highly divided, each main segment equivalent to a normal leaf, early color dull grey-green, becoming normal later.", ,Morph, ,
Rs,--,Root suppressed, , ,Greatly restricted or no root development.,4,Morph,RAD,
rt,--,potato virus Y resistance, , ,Resistance to potato virus Y., ,Disease,SPON,
rtd,--,retarded dwarf, , ,Small plant of slow growth; mature leaves drooping., ,Morph,SPON,
ru,--,ruptilis, , ,"Leaflets narrow, keeled, dull light green, darker veined; heterozygote variably intermediate.",3,Morph,RAD,
ru,prov2,ruptilis,provisional 2,ru,"Leaflets narrow, keeled, dull light green, darker veined; heterozygote temporarily intermediate.",3,Morph,CHEM,
rust,--,rustica, , ,"Dwarf plants with short internodes; leaves broad, and blunt with fewer segments.",8,Morph,RAD,
rust-2,--,rustica-2, ,rust2,"Small, lax bush; fewer, rounded pinnae.", ,Morph, ,
rv,--,reticulate virescent, , ,"Cotyledons and new leaves pale with dark veins, turning to normal green with age.",3,Morph,SPON,
rv-2,--,reticulate virescent-2, , ,Cotyledons light green; leaves yellowish with green veins., ,Morph,CHEM,
rv-4,--,reticulate virescent-4, , ,Sharply defined virescence- yellowish color of the immature leaves strongly contrasted with dark green network of the veins; seedling retarded., ,Morph,SPON,
rvt,--,red vascular tissue, , ,Vascular tissue deep red in roots and stems.,1,Morph,SPON,
rx-1,--, , , , ,1,Disease, ,
rx-2,--, , , , ,1,Disease, ,
s,--,compound inflorescence, , ,"Inflorescence branches excessively, resulting in a large hemispherical mass of 80 or more flowers and buds; inflorescence appears at every sixth node, instead of every third in normal genotypes.",2,Morph,SPON,
s,mult,compound inflorescence,multiflora,mult,Greatly increased number of flowers per inflorescence.,2,Morph,RAD,
sa,--,sphacelata, ,sa1,"Small plant; light yellowish leaves, developing necrotic lesions ventrally or on pinnae tips; environmentally sensitive.", ,Morph,RAD,
sar,--,squarrulosa, ,sar1,"Small plant, somewhat squarrose and slender branched.", ,Morph,RAD,
scf,--,scurfy, , ,"Striated, scurfy cotyledons.",1,Morph,SPON,
scl,--,seasonal chlorotic lethal, , ,"Cotyledons pale yellow, sometimes grooved; lethal in early stages except for recovery in mid summer.",8,Morph,SPON,
sco,--,scopulina, , ,"Plants reach 3/4 normal size, erect, bushy, thick coarse branches, internodes and leaves shortened; leaf segments large, broad, very wavy and rugose; fastigiate inflorescences resemble broom.", ,Morph, ,
sd,--,sun dwarf, , ,"Exposed leaves are greatly stunted, internodes less than 1 cm; stems somewhat constricted above the nodes, showing a brownish discoloration at first, scar tissue later; new shoots from base of plant grown normally until they break through the thick canopy of foliage; net effect on the whole plant is general stunting and extremely compact growth; growth is entirely normal throughout fall, winter and early spring, but during the rest of the year, phenotype is well expressed, at least under high light conditions; heterozygote is intermediate, but sometimes difficult to distinguish from +.",5,Morph,SPON,
sd-2,--,sun dwarf-2, , ,"Very short, scarred internodes in high light intensity; heterozygotes usually intermediate.", ,Morph, ,
sd-3,--,sun dwarf-3, , ,Interacts with sd-2 and br to yield birdsnest phenotype., ,Morph, ,
sdt,--,semideterminate habit, , ,Semideterminate habit in background of sp/sp., ,Morph,SPON,
Se,--,Septoria lycopersici resistance, , ,Resistance to Septoria lycopersici., ,Disease,SPON,
sem,--,semiglobosa, , ,"Smaller, compact plant; very short internodes; small dark leaves.", ,Morph,RAD,
sem-2,--,semiglobosa-2, ,sem2,"Smaller plant, leaves, pinnae; short internodes.", ,Morph, ,
ser,--,serpentina, ,ser1,"Curved shoots, leaves inflorescences.", ,Morph, ,
ser-2,--,serpentina-2, , ,"Seedlings normal; plant size almost normal; all vegetative parts, paricularly midveins and petioles irregularly elongated, resulting in twisting.", ,Morph, ,
ses,--,semisterilis, ,ses1,"Smaller, erect, nearly unbranched plant; thick, yellowish, light gray-green leaves; weakly fertile in greenhouse, unchanged on normal graft stock.",1,Morph,RAD,
sf,--,solanifolia, , ,Primary leaves entire; segments of later leaves entire and folded; filiform calyx and corolla; fruit shape often modified.,3,Morph,SPON,
sf,wl,solanifolia,wrinkled leaf,"wl, wr",Primary leaves entire; segments of later leaves entire and folded; filiform calyx and corolla.  Leaf margin finely wrinkled; flower parts small and distorted.,3,Morph,CHEM,
sfa,--,sufflaminata, ,sfa1,"Usually smaller, weakly branched plant; yellowish to yellow-green, involuted pinnae, purplish ventrally; slight F1 seedling heterosis.",1,Morph,RAD,
sfa,2,sufflaminata, ,par,"Usually smaller, weakly branched plant; yellowish to yellow-green, involuted pinnae, purplish ventrally; slight F1 seedling heterosis.",1,Morph,RAD,
sft,--,single flower truss, , ,"Reduced number of flowers per inflorescence, reduced number of inflorescences; indeterminate inflorescence;  flowering is delayed; only a few inflorescences develop, before reverting to indeterminate vegetative branches that infrequently produce single fertile flowers.",3,Morph,RAD,
sft,2,single flower truss, ,sft-1906,"Suppresses determinate growth imposed by the self-pruning (sp) mutation, restores indeterminate growth; average sympodial index = 3.",3,Morph,CHEM,
sh,--,sherry, , ,Fruit flesh yellow with reddish tinge.,10,Morph,RAD,
sha,--,short anthers, , ,Upper portion of anthers aborted; stigma protruding.  Plant and seeds of low viability., ,Morph,CHEM,
si,--,sinuata, , ,"Small plant, proportionately reduced; wavy, yellow-green leaves.",4,Morph,RAD,
sig-1,--,signal transduction-1, ,JL1,Deficient for production of proteinase inhibitor II in leaves following wounding, , ,CHEM,
sig-2,--,signal transduction-2, ,JL5,Deficient for production of proteinase inhibitor II in leaves following wounding, , ,CHEM,
sit,--,sitiens, , ,"Leaves overwilting and becoming necrotic; plant small and very  weak in field;  leaves short and down-curled, .",1,Morph,RAD,
Skdh-1,1,Shikimic acid dehydrogenase-1, , , ,1,Isozyme,SPON,
sl,--,stamenless, , ,Stamens usually reduced to mere vestiges adherent to the pistil; in the winter greenhouse stamens with normal pollen may appear; radial roughenings on the fruit surface attributed to adnation of stamens in early stages; fertile as female parent.,4,Morph,SPON,
sl,2,stamenless, ,sl2,"Nearly stamenless, anthers much distorted",4,Morph, ,
sl,3,stamenless, ,sl3,"Nearly stamenless, anthers much distorted; Like sl:2 except for greater anther development",4,Morph, ,
sl,4,stamenless, ,sl4,"Nearly stamenless, anthers much distorted; Like sl:2 except anthers nearly normal in winter greenhouse",4,Morph, ,
sl,cs,stamenless,corollaless,"cs, sl^5, sl5","Corolla and androecium sepaloid, stigma irregular and protruding.",4,Morph,SPON,
sl-2,--,stamenless-2, ,sl2,Stamens abortive or absent; fruit form modified. Same general features as sl except for subnormal stamens., ,Morph,SPON,
slx,--,serrate lax leaf, , ,"Drooping, elongate, serrate leaves.  Unknown variety from Romania.", ,Morph,SPON,
Sm,--,Stemphyllium resistance, , ,Resistance to Stemphylium solani.,11,Disease,SPON,
sms,--,small seed, , ,Endosperm almost absent; testa thin and transparent; reduced germination., ,Morph, ,
sn,--,singed, , ,"Epidermal hairs smaller; trichomes crooked, curved and otherwise distorted.",9,Morph,SPON,
snt,--,Snout, ,sn,Persistant style (beaked fruit), ,Morph,SPON,
